{
  "id": "room_meeting_q2_review",
  "name": "meeting-q2-review",
  "namespace": "acme-meetings",
  "protocol": "webrtc",
  "provider": "livekit",
  "type": "media",
  "mode": "peer-to-peer",
  "qualityOfService": "at-most-once",
  "ordering": "none",
  "persistence": {
    "enabled": false
  },
  "presence": {
    "enabled": true,
    "memberCount": 8
  },
  "access": {
    "scope": "private",
    "authMethod": "jwt",
    "capabilities": ["publish", "subscribe", "presence"]
  },
  "encryption": {
    "inFlight": true,
    "endToEnd": true,
    "algorithm": "AES-256-GCM"
  },
  "createdAt": "2026-05-22T15:00:00Z",
  "labels": {
    "tenant": "acme",
    "meeting-type": "review"
  }
}
